{
  "$schema": "../../../../schemas/extension.schema.json",
  "$comment": "用途：项目·复核级别。name=project_acceptance_level 是业务配置的稳定引用，移动文件不要改名。 在表单设计器的字段组件中选择 name；实例参数由 field.componentProps 传入。 实现：path 相对 workflow-web；default 是默认导出；kind=COMPONENT 表示 Vue 组件引用。 enabled 是构建安装开关，不代表数据库目录启停或页面已绑定。 supportedFieldTypes 声明兼容字段类型，设计时应按此范围选择。",
  "schemaVersion": 1,
  "type": "FIELD",
  "name": "project_acceptance_level",
  "label": "项目·复核级别",
  "description": "从节点级统一数据源加载选项和默认值。",
  "version": 1,
  "enabled": true,
  "implementation": {
    "path": "src/extensions/business/project/fields/ProjectAcceptanceLevelField.vue",
    "export": "default",
    "kind": "COMPONENT"
  },
  "metadata": {
    "supportedFieldTypes": [
      "SELECT",
      "RADIO",
      "STRING"
    ],
    "capabilities": {
      "executesManagedDataSource": true,
      "supportsReadonly": true
    }
  },
  "platforms": {
    "mobile": {
      "implementation": {
        "path": "src/extensions/ProjectAcceptanceLevelField.vue",
        "export": "default",
        "kind": "COMPONENT"
      },
      "capabilities": {
        "readonly": true,
        "editable": true,
        "validate": true
      }
    }
  }
}
