{
  "$schema": "../../../../schemas/extension.schema.json",
  "$comment": "统一表单组件 ProjectAcceptanceSummaryNode：在组件类型中选择，参数来自 configSchema；modelValue 为当前字段值，formData 为当前表单或子表行。多个字段变更通过 patch-form 交给宿主合并和校验。nodeTypes/supportedBindings 限制可用宿主，不产生第二种渲染方式。",
  "schemaVersion": 1,
  "type": "FIELD",
  "name": "ProjectAcceptanceSummaryNode",
  "label": "项目·验收摘要",
  "description": "读取表单上下文并通过统一字段更新协议展示验收摘要。",
  "version": 1,
  "enabled": true,
  "implementation": {
    "path": "src/extensions/business/project/fields/ProjectAcceptanceSummaryField.vue",
    "export": "default",
    "kind": "COMPONENT"
  },
  "metadata": {
    "snapshotVersion": 1,
    "nodeTypes": [
      "FIELD"
    ],
    "supportedBindings": [
      "ENTITY_FIELD"
    ],
    "configSchema": [
      {
        "key": "title",
        "label": "摘要标题",
        "type": "text",
        "defaultValue": "扩展执行摘要",
        "description": "当前组件实例显示的标题；只改变展示文案，不修改实体或表单的业务名称。"
      }
    ],
    "capabilities": {
      "readsWholeForm": true,
      "executesManagedDataSource": true
    }
  },
  "platforms": {
    "mobile": {
      "implementation": {
        "path": "src/extensions/ProjectAcceptanceSummaryField.vue",
        "export": "default",
        "kind": "COMPONENT"
      },
      "capabilities": {
        "readonly": true,
        "editable": true,
        "validate": true
      }
    }
  }
}
