{
  "$schema": "../../../schemas/extension.schema.json",
  "$comment": "用途：金额校验。name=amount 是业务配置的稳定引用，移动文件不要改名。 在表单字段自定义校验中绑定 name/version；每个字段的规则 params 作为 validate(value, context) 的 context.params 传入。 实现：path 相对 workflow-web；AmountValidator 是具名导出；kind=CLASS 表示无参 new 类实例，实例必须提供 validate。 enabled 是构建安装开关，不代表数据库目录启停或页面已绑定。 supportedEntityCodes 使用实体编码；空数组或 [\"*\"] 表示不限，不是授权配置。 supportedFieldTypes 声明兼容字段类型，设计时应按此范围选择。 configSchema 只定义参数，各实例的实际取值另存；每项 description 说明用途。",
  "schemaVersion": 1,
  "type": "VALIDATOR",
  "name": "amount",
  "label": "金额校验",
  "description": "金额必须为非负有限数字，且不超过当前字段配置的上限；空值交给必填规则。",
  "version": 1,
  "enabled": true,
  "implementation": {
    "path": "src/extensions/common/validators/AmountValidator.js",
    "export": "AmountValidator",
    "kind": "CLASS"
  },
  "metadata": {
    "supportedEntityCodes": [
      "*"
    ],
    "supportedFieldTypes": [
      "INTEGER",
      "LONG",
      "DECIMAL",
      "DOUBLE",
      "NUMBER",
      "STRING"
    ],
    "configSchema": [
      {
        "key": "maxAmount",
        "label": "金额上限",
        "type": "number",
        "required": true,
        "min": 0,
        "defaultValue": 1000,
        "description": "金额上限，必须是非负有限数字；每个字段独立配置。空值交给必填规则，0 仍参与范围判断。"
      }
    ]
  },
  "platforms": {
    "mobile": {
      "implementation": {
        "path": "src/extensions/AmountValidator.js",
        "export": "AmountValidator",
        "kind": "CLASS"
      },
      "capabilities": {
        "readonly": true,
        "editable": true,
        "validate": true
      }
    }
  }
}
