{
  "$schema": "../../../../schemas/extension.schema.json",
  "$comment": "用途：项目·扩展验收整表单。name=ProjectExtensionAcceptanceForm 是业务配置的稳定引用，移动文件不要改名。 在实体表单中选择 name，实例参数由 viewConfig.customComponentProps 传入 config。 实现：path 相对 workflow-web；default 是默认导出；kind=COMPONENT 表示 Vue 组件引用。 enabled 是构建安装开关，不代表数据库目录启停或页面已绑定。 usageContexts=PAGE 用于普通页面；关联内容组件必须使用独立契约。 configSchema 只定义参数，各实例的实际取值另存；每项 description 说明用途。",
  "schemaVersion": 1,
  "type": "FORM",
  "name": "ProjectExtensionAcceptanceForm",
  "label": "项目·扩展验收整表单",
  "description": "覆盖新增、编辑、查看和审批模式，并可手工触发表单统一数据源。",
  "version": 1,
  "enabled": true,
  "implementation": {
    "path": "src/extensions/business/project/forms/ProjectExtensionAcceptanceForm.vue",
    "export": "default",
    "kind": "COMPONENT"
  },
  "metadata": {
    "snapshotVersion": 1,
    "supportedModes": [
      "create",
      "edit",
      "approve",
      "view"
    ],
    "configSchema": [
      {
        "key": "title",
        "label": "表单标题",
        "type": "text",
        "defaultValue": "项目扩展验收单",
        "description": "当前组件实例显示的标题；只改变展示文案，不修改实体或表单的业务名称。"
      },
      {
        "key": "showRuntimeTrace",
        "label": "显示执行轨迹",
        "type": "boolean",
        "defaultValue": true,
        "description": "是否展示验收组件的运行上下文/执行信息，便于检查宿主接入。"
      }
    ],
    "capabilities": {
      "exposesValidate": true,
      "executesManagedDataSource": true,
      "supportsWorkflowModes": true
    },
    "usageContexts": [
      "PAGE"
    ]
  },
  "platforms": {
    "mobile": {
      "implementation": {
        "path": "src/extensions/ProjectExtensionAcceptanceForm.vue",
        "export": "default",
        "kind": "COMPONENT"
      },
      "capabilities": {
        "readonly": true,
        "editable": true,
        "validate": true
      }
    }
  }
}
